text,parsed,confirmed
remind me to z in 2 minutes,remind me to z in 2 minutes,z
remind me to drink water in 5 minutes,remind me to drink water in 5 minutes,drink water
sasha, you're asking to remind you at 05-17-2020 23:42:33 to remind me to go to sleep in 1 hour, right?,remind me to go to sleep in 1 hour,remind me to go to sleep in 1 hour
remind me to drink water in 5 minutes,remind me to drink water in 5 minutes,drink water
remind me to watch spacex launch in 50 minutes,remind me to watch spacex launch in 50 minutes,watch spacex launch
sasha, you're asking to remind you at 05-31-2020 02:49:52 to drink water, right?,remind me to drink water in 5 minutes,remind me to drink water in 5 minutes
Sasha, you're asking to remind you at 05-31-2020 02:53:13 to drink water, right?,remind me to drink water in 5 minutes,remind me to drink water in 5 minutes